Sheet: Result
A1: Use Case Point Toolkit
A3: Unadjusted Use Case Weight | B3: of:=['Use Cases'.D«getUseCaseSumRow()»] -> 
A4: Unadjusted Actor Weight | B4: of:=[Actors.D«getActorSumRow()»] -> 
A5: Technical Complexity Factor | B5: of:=['Technical Complexity'.E«getTechnicalFactorRow()»] -> 
A6: Environmental Complexity Factor | B6: of:=['Environmental Complexity'.E«getEnvironmentalFactorRow()»] -> 
A7: Unadjusted Use Case Points | C7: of:=[.B3]+[.B4] -> 18
A8: Adjusted Use Case Points | C8: of:=[.C7]*[.B5]*[.B6] -> 14.90625
A9: Hours per Use Case Point | B9: 20
A10: Total hours | C10: of:=[.C8]*[.B9] -> 298.125
A11: Person days | C11: of:=[.C10]/8 -> 37.265625
A12: Cost per day | B12: 800
A13: COST BC | C13: of:=[.C11]*[.B12] -> 29812.5

Sheet: Use Cases
A1: Use Cases
A2: item | B2: Use Case | C2: Complexity | D2: Weight | E2: Package
A3: Unadjusted Use Case Weight | D3: of:=SUM([.D3:.D«getUseCaseLastRow()»]) -> 

Sheet: Actors
A1: Actors
A2: item | B2: Actor | C2: Complexity | D2: Weight | E2: Package
A3: Unadjusted Actor Weight | D3: of:=SUM([.D3:.D«getActorLastRow()»]) -> 

Sheet: Technical Complexity
A1: Technical Complexity
A2: item | B2: Technical Complexity | C2: Value | D2: Weight | E2: Total | F2: Question | G2: Answer
A3: Tfactor | E3: of:=SUM([.E3:.E«getTechnicalLastRow()»]) -> 
A4: RESULT Technical Complexity | E4: of:=0.6+(0.01*[.E«getTechnicalLastRow() + 1»]) -> 

Sheet: Environmental Complexity
A1: Environmental Complexity
A2: item | B2: Environmental Complexity | C2: Value | D2: Weight | E2: Total | F2: Question | G2: Answer
A3: Efactor | E3: of:=SUM([.E3:.E«getEnvironmentalLastRow()»]) -> 
A4: RESULT Environmental Complexity Factor | E4: of:=1.4+(-0.03*[.E«getEnvironmentalLastRow() + 1»]) -> 